"COUNTER STATEMENT TO 26 Rule 56.1 Statement. Document filed by New Hampshire Insurance Company, American Home Assurance Company, National Union Fire Insurance Company of Pittsburgh, Pennsylvania. (Cotton, Stuart) (Entered: 04/11/2007)",New Hampshire Insurance Company American Home Assurance Company National Union Fire Insurance Company of Pittsburgh,Stuart,"COUNTER STATEMENT TO 26 Rule 56.1 Statement . Document filed by -ORG- -ORG- -ORG- -ORG- , -ORG- -ORG- -ORG- -ORG- , -ORG- -ORG- -ORG- -ORG- -ORG- -ORG- -ORG- , Pennsylvania . ( Cotton , -NAME- ) ( Entered : 04/11/2007 )","COUNTER STATEMENT TO 26 Rule 56.1 Statement . Document filed by , , , Pennsylvania . ( Cotton , ) ( Entered : 04/11/2007 )",counter rule,,counter rule,counter rule,"['counter rule .', 'document file .']","['counter rule .', 'document file .']","['counter rule .', 'document file .']",Summary Judgment Filing,Y,Triage
"RULE 56.1 STATEMENT. Document filed by AXA Versicherung AG. (Attachments: # 1 56.1 Statement continued)(Keely, Sean) (Entered: 04/11/2007)",AXA Versicherung AG,Sean,"RULE 56.1 STATEMENT . Document filed by -ORG- -ORG- -ORG- . ( Attachments : # 1 56.1 Statement continued ) ( Keely , -NAME- ) ( Entered : 04/11/2007 )","RULE 56.1 STATEMENT . Document filed by . ( Attachments : # 1 56.1 Statement continued ) ( Keely , ) ( Entered : 04/11/2007 )",rule,,rule,rule,"['rule .', 'document file .']","['rule .', 'document file .']","['rule .', 'document file .']",Summary Judgment Filing,Y,Triage
"RULE 56.1 STATEMENT. Document filed by AXA Versicherung AG. (Cyr, Joseph) (Entered: 04/27/2007)",AXA Versicherung AG,Joseph,"RULE 56.1 STATEMENT . Document filed by -ORG- -ORG- -ORG- . ( Cyr , -NAME- ) ( Entered : 04/27/2007 )","RULE 56.1 STATEMENT . Document filed by . ( Cyr , ) ( Entered : 04/27/2007 )",rule,,rule,rule,"['rule .', 'document file .']","['rule .', 'document file .']","['rule .', 'document file .']",Summary Judgment Filing,Y,Triage
"COUNTER STATEMENT TO 22 Rule 56.1 Statement. Document filed by AXA Versicherung AG. (Keely, Sean) (Entered: 04/27/2007)",AXA Versicherung AG,Sean,"COUNTER STATEMENT TO 22 Rule 56.1 Statement . Document filed by -ORG- -ORG- -ORG- . ( Keely , -NAME- ) ( Entered : 04/27/2007 )","COUNTER STATEMENT TO 22 Rule 56.1 Statement . Document filed by . ( Keely , ) ( Entered : 04/27/2007 )",counter rule,,counter rule,counter rule,"['counter rule .', 'document file .']","['counter rule .', 'document file .']","['counter rule .', 'document file .']",Summary Judgment Filing,Y,Triage
"COUNTER STATEMENT TO 44 Rule 56.1 Statement. Document filed by New Hampshire Insurance Company, American Home Assurance Company, National Union Fire Insurance Company of Pittsburgh, Pennsylvania. (Cotton, Stuart) (Entered: 04/30/2007)",New Hampshire Insurance Company American Home Assurance Company National Union Fire Insurance Company of Pittsburgh,Stuart,"COUNTER STATEMENT TO 44 Rule 56.1 Statement . Document filed by -ORG- -ORG- -ORG- -ORG- , -ORG- -ORG- -ORG- -ORG- , -ORG- -ORG- -ORG- -ORG- -ORG- -ORG- -ORG- , Pennsylvania . ( Cotton , -NAME- ) ( Entered : 04/30/2007 )","COUNTER STATEMENT TO 44 Rule 56.1 Statement . Document filed by , , , Pennsylvania . ( Cotton , ) ( Entered : 04/30/2007 )",counter rule,,counter rule,counter rule,"['counter rule .', 'document file .']","['counter rule .', 'document file .']","['counter rule .', 'document file .']",Summary Judgment Filing,Y,Triage
Minute Entry for proceedings held before Judge Jed S. Rakoff :. Jury Trial set for 9/24/2007 09:00 AM before Judge Jed S. Rakoff. (mbe) (Entered: 05/29/2007),,Jed S. Rakoff Jed S. Rakoff,Minute Entry for proceedings held before Judge -NAME- -NAME- -NAME- : . Jury Trial set for 9/24/2007 09:00 AM before Judge -NAME- -NAME- -NAME- . ( mbe ) ( Entered : 05/29/2007 ),Minute Entry for proceedings held before Judge : . Jury Trial set for 9/24/2007 09:00 AM before Judge . ( mbe ) ( Entered : 05/29/2007 ),minute entry hold jury trial,,minute entry hold jury trial,jury_trial,"['minute entry hold .', 'jury trial .']","['minute entry hold .', 'jury trial .']","['minute_entry_hold .', 'jury_trial .']",System Msg,N,
TRANSCRIPT of proceedings held on 5/16/2007 before Judge Jed S. Rakoff. (jp) (Entered: 07/27/2007),,Jed S. Rakoff,TRANSCRIPT of proceedings held on 5/16/2007 before Judge -NAME- -NAME- -NAME- . ( jp ) ( Entered : 07/27/2007 ),TRANSCRIPT of proceedings held on 5/16/2007 before Judge . ( jp ) ( Entered : 07/27/2007 ),hold,,hold,hold,['hold .'],['hold .'],['hold .'],Transcript,Y,Triage
"BRIEF in Support of Motion to Strike Jury Demand. Document filed by New Hampshire Insurance Company, American Home Assurance Company, National Union Fire Insurance Company of Pittsburgh, Pennsylvania.(Cotton, Stuart) (Entered: 07/31/2007)",New Hampshire Insurance Company American Home Assurance Company National Union Fire Insurance Company of Pittsburgh,Stuart,"BRIEF in Support of Motion to Strike Jury Demand . Document filed by -ORG- -ORG- -ORG- -ORG- , -ORG- -ORG- -ORG- -ORG- , -ORG- -ORG- -ORG- -ORG- -ORG- -ORG- -ORG- , Pennsylvania . ( Cotton , -NAME- ) ( Entered : 07/31/2007 )","BRIEF in Support of Motion to Strike Jury Demand . Document filed by , , , Pennsylvania . ( Cotton , ) ( Entered : 07/31/2007 )",brief support motion strike jury demand,,brief support motion strike jury demand,brief support motion strike jury demand,"['brief support motion strike jury demand .', 'document file .']","['brief support motion strike jury demand .', 'document file .']","['brief support motion strike jury demand .', 'document file .']",Trial Filing,Y,Triage
"BRIEF in Support of Motion to Strike Jury Demand. Document filed by New Hampshire Insurance Company, American Home Assurance Company, National Union Fire Insurance Company of Pittsburgh, Pennsylvania.(Kenna, David) (Entered: 08/07/2007)",New Hampshire Insurance Company American Home Assurance Company National Union Fire Insurance Company of Pittsburgh,Kenna David,"BRIEF in Support of Motion to Strike Jury Demand . Document filed by -ORG- -ORG- -ORG- -ORG- , -ORG- -ORG- -ORG- -ORG- , -ORG- -ORG- -ORG- -ORG- -ORG- -ORG- -ORG- , Pennsylvania . ( -NAME- , -NAME- ) ( Entered : 08/07/2007 )","BRIEF in Support of Motion to Strike Jury Demand . Document filed by , , , Pennsylvania . ( , ) ( Entered : 08/07/2007 )",brief support motion strike jury demand,,brief support motion strike jury demand,brief support motion strike jury demand,"['brief support motion strike jury demand .', 'document file .']","['brief support motion strike jury demand .', 'document file .']","['brief support motion strike jury demand .', 'document file .']",Brief,Y,Triage
"RULE 26 DISCLOSURE.Document filed by AXA Versicherung AG. (Attachments: # 1 Exhibit A, # 2 Exhibit B)(Keely, Sean) (Entered: 12/21/2007)",AXA Versicherung AG,Sean,"RULE 26 DISCLOSURE.Document filed by -ORG- -ORG- -ORG- . ( Attachments : # 1 Exhibit A , # 2 Exhibit B ) ( Keely , -NAME- ) ( Entered : 12/21/2007 )","RULE 26 DISCLOSURE.Document filed by . ( Attachments : # 1 Exhibit A , # 2 Exhibit B ) ( Keely , ) ( Entered : 12/21/2007 )",rule disclosure,,rule disclosure,,['rule disclosure.document file .'],['rule disclosure.document file .'],['rule disclosure.document file .'],Discovery,Y,Triage
"RULE 26 DISCLOSURE.Document filed by New Hampshire Insurance Company, American Home Assurance Company, National Union Fire Insurance Company of Pittsburgh, Pennsylvania. (Attachments: # 1 Errata A)(Kenna, David) (Entered: 12/21/2007)",New Hampshire Insurance Company American Home Assurance Company National Union Fire Insurance Company of Pittsburgh,Kenna David,"RULE 26 DISCLOSURE.Document filed by -ORG- -ORG- -ORG- -ORG- , -ORG- -ORG- -ORG- -ORG- , -ORG- -ORG- -ORG- -ORG- -ORG- -ORG- -ORG- , Pennsylvania . ( Attachments : # 1 Errata A ) ( -NAME- , -NAME- ) ( Entered : 12/21/2007 )","RULE 26 DISCLOSURE.Document filed by , , , Pennsylvania . ( Attachments : # 1 Errata A ) ( , ) ( Entered : 12/21/2007 )",rule disclosure,,rule disclosure,,['rule disclosure.document file .'],['rule disclosure.document file .'],['rule disclosure.document file .'],Discovery,Y,Triage
"MOTION in Limine. Document filed by AXA Versicherung AG. Return Date set for 1/14/2008 at 09:00 AM.(Keely, Sean) (Entered: 12/31/2007)",AXA Versicherung AG,Sean,"MOTION in Limine . Document filed by -ORG- -ORG- -ORG- . Return Date set for 1/14/2008 at 09:00 AM . ( Keely , -NAME- ) ( Entered : 12/31/2007 )","MOTION in Limine . Document filed by . Return Date set for 1/14/2008 at 09:00 AM . ( Keely , ) ( Entered : 12/31/2007 )",motion limine,,motion limine,motion_limine,"['motion limine .', 'document file .', '.']","['motion limine .', 'document file .', '.']","['motion_limine .', 'document file .', '.']",Motion,Y,Triage
"MOTION in Limine to preclude plaintiff from introducing evidence of contract claims. Document filed by New Hampshire Insurance Company, American Home Assurance Company, National Union Fire Insurance Company of Pittsburgh, Pennsylvania. Return Date set for 1/14/2008 at 09:00 AM. (Attachments: # 1 Text of Proposed Order, # 2 Affidavit Affidavit of Service)(Kenna, David) (Entered: 01/02/2008)",New Hampshire Insurance Company American Home Assurance Company National Union Fire Insurance Company of Pittsburgh,Kenna David,"MOTION in Limine to preclude plaintiff from introducing evidence of contract claims . Document filed by -ORG- -ORG- -ORG- -ORG- , -ORG- -ORG- -ORG- -ORG- , -ORG- -ORG- -ORG- -ORG- -ORG- -ORG- -ORG- , Pennsylvania . Return Date set for 1/14/2008 at 09:00 AM . ( Attachments : # 1 Text of Proposed Order , # 2 Affidavit Affidavit of Service ) ( -NAME- , -NAME- ) ( Entered : 01/02/2008 )","MOTION in Limine to preclude plaintiff from introducing evidence of contract claims . Document filed by , , , Pennsylvania . Return Date set for 1/14/2008 at 09:00 AM . ( Attachments : # 1 Text of Proposed Order , # 2 Affidavit Affidavit of Service ) ( , ) ( Entered : 01/02/2008 )",motion limine preclude introduce evidence contract,,motion limine preclude introduce evidence contract,motion_limine preclude introduce evidence contract,"['motion limine preclude introduce evidence contract .', 'document file .', '.']","['motion limine preclude introduce evidence contract .', 'document file .', '.']","['motion_limine preclude introduce evidence contract .', 'document file .', '.']",Motion,Y,Triage
"MOTION in Limine to preclude plaintiff from introducing evidence contradicting positions taken by plaintiff's corporate designee deposed pursuant to Rule 30(B)(6). Document filed by New Hampshire Insurance Company, American Home Assurance Company, National Union Fire Insurance Company of Pittsburgh, Pennsylvania. Return Date set for 1/14/2008 at 09:00 AM. (Attachments: # 1 Text of Proposed Order, # 2 Affidavit Affidavit of Service)(Kenna, David) (Entered: 01/02/2008)",New Hampshire Insurance Company American Home Assurance Company National Union Fire Insurance Company of Pittsburgh,Kenna David,"MOTION in Limine to preclude plaintiff from introducing evidence contradicting positions taken by plaintiff 's corporate designee deposed pursuant to Rule 30 ( B ) ( 6 ) . Document filed by -ORG- -ORG- -ORG- -ORG- , -ORG- -ORG- -ORG- -ORG- , -ORG- -ORG- -ORG- -ORG- -ORG- -ORG- -ORG- , Pennsylvania . Return Date set for 1/14/2008 at 09:00 AM . ( Attachments : # 1 Text of Proposed Order , # 2 Affidavit Affidavit of Service ) ( -NAME- , -NAME- ) ( Entered : 01/02/2008 )","MOTION in Limine to preclude plaintiff from introducing evidence contradicting positions taken by plaintiff 's corporate designee deposed pursuant to Rule 30 ( B ) ( 6 ) . Document filed by , , , Pennsylvania . Return Date set for 1/14/2008 at 09:00 AM . ( Attachments : # 1 Text of Proposed Order , # 2 Affidavit Affidavit of Service ) ( , ) ( Entered : 01/02/2008 )",motion limine preclude introduce evidence contradict position corporate designee depose rule,,motion limine preclude introduce evidence contradict position corporate designee depose rule,motion_limine preclude introduce evidence contradict position corporate designee depose rule,"['motion limine preclude introduce evidence contradict position corporate designee depose rule .', 'document file .', '.']","['motion limine preclude introduce evidence contradict position corporate designee depose rule .', 'document file .', '.']","['motion_limine preclude introduce evidence contradict position corporate designee depose rule .', 'document file .', '.']",Motion,Y,Triage
"MOTION in Limine precluding the testimony of plaintiff's expert Markus Heiss. Document filed by New Hampshire Insurance Company, American Home Assurance Company, National Union Fire Insurance Company of Pittsburgh, Pennsylvania. Return Date set for 1/14/2008 at 09:00 AM. (Attachments: # 1 Text of Proposed Order, # 2 Affidavit Affidavit of Service)(Kenna, David) (Entered: 01/02/2008)",New Hampshire Insurance Company American Home Assurance Company National Union Fire Insurance Company of Pittsburgh,Markus Heiss Kenna David,"MOTION in Limine precluding the testimony of plaintiff 's expert -NAME- -NAME- . Document filed by -ORG- -ORG- -ORG- -ORG- , -ORG- -ORG- -ORG- -ORG- , -ORG- -ORG- -ORG- -ORG- -ORG- -ORG- -ORG- , Pennsylvania . Return Date set for 1/14/2008 at 09:00 AM . ( Attachments : # 1 Text of Proposed Order , # 2 Affidavit Affidavit of Service ) ( -NAME- , -NAME- ) ( Entered : 01/02/2008 )","MOTION in Limine precluding the testimony of plaintiff 's expert . Document filed by , , , Pennsylvania . Return Date set for 1/14/2008 at 09:00 AM . ( Attachments : # 1 Text of Proposed Order , # 2 Affidavit Affidavit of Service ) ( , ) ( Entered : 01/02/2008 )",motion limine preclude testimony,,motion limine preclude testimony,motion_limine preclude testimony,"['motion limine preclude testimony .', 'document file .', '.']","['motion limine preclude testimony .', 'document file .', '.']","['motion_limine preclude testimony .', 'document file .', '.']",Motion,Y,Triage
"MOTION in Limine to preclude plaintiff from introducing evidence pertaining to other reinsurers. Document filed by New Hampshire Insurance Company, American Home Assurance Company, National Union Fire Insurance Company of Pittsburgh, Pennsylvania. Return Date set for 1/14/2008 at 09:00 AM. (Attachments: # 1 Text of Proposed Order, # 2 Affidavit Affidavit of Service)(Kenna, David) (Entered: 01/02/2008)",New Hampshire Insurance Company American Home Assurance Company National Union Fire Insurance Company of Pittsburgh,Kenna David,"MOTION in Limine to preclude plaintiff from introducing evidence pertaining to other reinsurers . Document filed by -ORG- -ORG- -ORG- -ORG- , -ORG- -ORG- -ORG- -ORG- , -ORG- -ORG- -ORG- -ORG- -ORG- -ORG- -ORG- , Pennsylvania . Return Date set for 1/14/2008 at 09:00 AM . ( Attachments : # 1 Text of Proposed Order , # 2 Affidavit Affidavit of Service ) ( -NAME- , -NAME- ) ( Entered : 01/02/2008 )","MOTION in Limine to preclude plaintiff from introducing evidence pertaining to other reinsurers . Document filed by , , , Pennsylvania . Return Date set for 1/14/2008 at 09:00 AM . ( Attachments : # 1 Text of Proposed Order , # 2 Affidavit Affidavit of Service ) ( , ) ( Entered : 01/02/2008 )",motion limine preclude introduce evidence pertain reinsurers,,motion limine preclude introduce evidence pertain reinsurers,motion_limine preclude introduce evidence pertain reinsurers,"['motion limine preclude introduce evidence pertain reinsurers .', 'document file .', '.']","['motion limine preclude introduce evidence pertain reinsurers .', 'document file .', '.']","['motion_limine preclude introduce evidence pertain reinsurers .', 'document file .', '.']",Motion,Y,Triage
"MOTION in Limine regarding plaintiff's expert Richard Waterman. Document filed by New Hampshire Insurance Company, American Home Assurance Company, National Union Fire Insurance Company of Pittsburgh, Pennsylvania. Return Date set for 1/14/2008 at 09:00 AM. (Attachments: # 1 Text of Proposed Order, # 2 Affidavit Affidavit of Service)(Kenna, David) (Entered: 01/02/2008)",New Hampshire Insurance Company American Home Assurance Company National Union Fire Insurance Company of Pittsburgh,Richard Waterman Kenna David,"MOTION in Limine regarding plaintiff 's expert -NAME- -NAME- . Document filed by -ORG- -ORG- -ORG- -ORG- , -ORG- -ORG- -ORG- -ORG- , -ORG- -ORG- -ORG- -ORG- -ORG- -ORG- -ORG- , Pennsylvania . Return Date set for 1/14/2008 at 09:00 AM . ( Attachments : # 1 Text of Proposed Order , # 2 Affidavit Affidavit of Service ) ( -NAME- , -NAME- ) ( Entered : 01/02/2008 )","MOTION in Limine regarding plaintiff 's expert . Document filed by , , , Pennsylvania . Return Date set for 1/14/2008 at 09:00 AM . ( Attachments : # 1 Text of Proposed Order , # 2 Affidavit Affidavit of Service ) ( , ) ( Entered : 01/02/2008 )",motion limine,,motion limine,motion_limine,"['motion limine .', 'document file .', '.']","['motion limine .', 'document file .', '.']","['motion_limine .', 'document file .', '.']",Motion,Y,Triage
"ORDER: The Court, having reviewed in camera both the Confidentiality Agreement and the Decision and Award, at this point reaches only the procedural issue, and hereby orders that counsel for AIG forthwith furnish both the Confidentiality Agreement and the Decision and Award to counsel for AXA, for the reasons and on the following terms listed herein. (Signed by Judge Jed S. Rakoff on 12/26/07) (tro) (Entered: 01/02/2008)",AIG AXA,Jed S. Rakoff,"ORDER : The Court , having reviewed in camera both the Confidentiality Agreement and the Decision and Award , at this point reaches only the procedural issue , and hereby orders that counsel for -ORG- forthwith furnish both the Confidentiality Agreement and the Decision and Award to counsel for -ORG- , for the reasons and on the following terms listed herein . ( Signed by Judge -NAME- -NAME- -NAME- on 12/26/07 ) ( tro ) ( Entered : 01/02/2008 )","ORDER : The Court , having reviewed in camera both the Confidentiality Agreement and the Decision and Award , at this point reaches only the procedural issue , and hereby orders that counsel for forthwith furnish both the Confidentiality Agreement and the Decision and Award to counsel for , for the reasons and on the following terms listed herein . ( Signed by Judge on 12/26/07 ) ( tro ) ( Entered : 01/02/2008 )",order camera confidentiality decision award point reach procedural order forthwith furnish confidentiality decision award reason term list herein,,order camera confidentiality decision award point reach procedural order forthwith furnish confidentiality decision award reason term list herein,order camera confidentiality decision award point reach procedural order forthwith furnish confidentiality decision award reason term list herein,['order camera confidentiality decision award point reach procedural issue order forthwith furnish confidentiality decision award reason term list herein .'],['order camera confidentiality decision award point reach procedural issue order forthwith furnish confidentiality decision award reason term list herein .'],['order camera confidentiality decision award point reach procedural issue order forthwith furnish confidentiality decision award reason term list herein .'],Court's Order,Y,Triage
"PROPOSED JURY INSTRUCTIONS. Document filed by New Hampshire Insurance Company, American Home Assurance Company, National Union Fire Insurance Company of Pittsburgh, Pennsylvania.(Kenna, David) (Entered: 01/07/2008)",New Hampshire Insurance Company American Home Assurance Company National Union Fire Insurance Company of Pittsburgh,Kenna David,"PROPOSED JURY INSTRUCTIONS . Document filed by -ORG- -ORG- -ORG- -ORG- , -ORG- -ORG- -ORG- -ORG- , -ORG- -ORG- -ORG- -ORG- -ORG- -ORG- -ORG- , Pennsylvania . ( -NAME- , -NAME- ) ( Entered : 01/07/2008 )","PROPOSED JURY INSTRUCTIONS . Document filed by , , , Pennsylvania . ( , ) ( Entered : 01/07/2008 )",propose jury instruction,,propose jury instruction,propose jury instruction,"['propose jury instruction .', 'document file .']","['propose jury instruction .', 'document file .']","['propose jury instruction .', 'document file .']",Trial Filing,Y,Triage
"PROPOSED JURY INSTRUCTIONS. Document filed by AXA Versicherung AG.(Keely, Sean) (Entered: 01/07/2008)",AXA Versicherung AG,Sean,"PROPOSED JURY INSTRUCTIONS . Document filed by -ORG- -ORG- -ORG- . ( Keely , -NAME- ) ( Entered : 01/07/2008 )","PROPOSED JURY INSTRUCTIONS . Document filed by . ( Keely , ) ( Entered : 01/07/2008 )",propose jury instruction,,propose jury instruction,propose jury instruction,"['propose jury instruction .', 'document file .']","['propose jury instruction .', 'document file .']","['propose jury instruction .', 'document file .']",Trial Filing,Y,Triage
"PROPOSED VOIR DIRE QUESTIONS. Document filed by AXA Versicherung AG.(Cyr, Joseph) (Entered: 01/09/2008)",AXA Versicherung AG,Joseph,"PROPOSED VOIR DIRE QUESTIONS . Document filed by -ORG- -ORG- -ORG- . ( Cyr , -NAME- ) ( Entered : 01/09/2008 )","PROPOSED VOIR DIRE QUESTIONS . Document filed by . ( Cyr , ) ( Entered : 01/09/2008 )",propose voir dire question,,propose voir dire question,propose voir dire question,"['propose voir dire question .', 'document file .']","['propose voir dire question .', 'document file .']","['propose voir dire question .', 'document file .']",Trial Filing,Y,Triage
"PROPOSED VOIR DIRE QUESTIONS. Document filed by New Hampshire Insurance Company, American Home Assurance Company, National Union Fire Insurance Company of Pittsburgh, Pennsylvania.(Kenna, David) (Entered: 01/09/2008)",New Hampshire Insurance Company American Home Assurance Company National Union Fire Insurance Company of Pittsburgh,Kenna David,"PROPOSED VOIR DIRE QUESTIONS . Document filed by -ORG- -ORG- -ORG- -ORG- , -ORG- -ORG- -ORG- -ORG- , -ORG- -ORG- -ORG- -ORG- -ORG- -ORG- -ORG- , Pennsylvania . ( -NAME- , -NAME- ) ( Entered : 01/09/2008 )","PROPOSED VOIR DIRE QUESTIONS . Document filed by , , , Pennsylvania . ( , ) ( Entered : 01/09/2008 )",propose voir dire question,,propose voir dire question,propose voir dire question,"['propose voir dire question .', 'document file .']","['propose voir dire question .', 'document file .']","['propose voir dire question .', 'document file .']",Trial Filing,Y,Triage
Minute Entry for proceedings held before Judge Jed S. Rakoff: Jury Trial begun on 1/14/2008. (ja) (Entered: 02/11/2008),,Jed S. Rakoff,Minute Entry for proceedings held before Judge -NAME- -NAME- -NAME- : Jury Trial begun on 1/14/2008 . ( ja ) ( Entered : 02/11/2008 ),Minute Entry for proceedings held before Judge : Jury Trial begun on 1/14/2008 . ( ja ) ( Entered : 02/11/2008 ),minute entry hold jury trial begin,,minute entry hold jury trial begin,jury_trial begin,['minute entry hold jury trial begin .'],['minute entry hold jury trial begin .'],['minute_entry_hold jury_trial begin .'],System Msg,N,
Minute Entry for proceedings held before Judge Jed S. Rakoff: Jury Trial held on 1/15/2008. (ja) (Entered: 02/11/2008),,Jed S. Rakoff,Minute Entry for proceedings held before Judge -NAME- -NAME- -NAME- : Jury Trial held on 1/15/2008 . ( ja ) ( Entered : 02/11/2008 ),Minute Entry for proceedings held before Judge : Jury Trial held on 1/15/2008 . ( ja ) ( Entered : 02/11/2008 ),minute entry hold jury trial hold,,minute entry hold jury trial hold,,['minute entry hold jury trial hold .'],['minute entry hold jury trial hold .'],['minute_entry_hold jury_trial_hold .'],System Msg,N,
Minute Entry for proceedings held before Judge Jed S. Rakoff: Jury Trial held on 1/16/2008. (ja) (Entered: 02/11/2008),,Jed S. Rakoff,Minute Entry for proceedings held before Judge -NAME- -NAME- -NAME- : Jury Trial held on 1/16/2008 . ( ja ) ( Entered : 02/11/2008 ),Minute Entry for proceedings held before Judge : Jury Trial held on 1/16/2008 . ( ja ) ( Entered : 02/11/2008 ),minute entry hold jury trial hold,,minute entry hold jury trial hold,,['minute entry hold jury trial hold .'],['minute entry hold jury trial hold .'],['minute_entry_hold jury_trial_hold .'],System Msg,N,
COURT EXHIBIT 3 FROM TRIAL. Document filed by AXA Versicherung AG.(djc) (Entered: 02/06/2008),AXA Versicherung AG,,COURT EXHIBIT 3 FROM TRIAL . Document filed by -ORG- -ORG- -ORG- . ( djc ) ( Entered : 02/06/2008 ),COURT EXHIBIT 3 FROM TRIAL . Document filed by . ( djc ) ( Entered : 02/06/2008 ),trial,,trial,trial,"['trial .', 'document file .']","['trial .', 'document file .']","['trial .', 'document file .']",Trial Filing,Y,Triage
Minute Entry for proceedings held before Judge Jed S. Rakoff: Jury Trial held on 1/17/2008. (ja) (Entered: 02/11/2008),,Jed S. Rakoff,Minute Entry for proceedings held before Judge -NAME- -NAME- -NAME- : Jury Trial held on 1/17/2008 . ( ja ) ( Entered : 02/11/2008 ),Minute Entry for proceedings held before Judge : Jury Trial held on 1/17/2008 . ( ja ) ( Entered : 02/11/2008 ),minute entry hold jury trial hold,,minute entry hold jury trial hold,,['minute entry hold jury trial hold .'],['minute entry hold jury trial hold .'],['minute_entry_hold jury_trial_hold .'],System Msg,N,
Minute Entry for proceedings held before Judge Jed S. Rakoff: Jury Trial held on 1/18/2008 and continued on 1/22/08. (ja) (Entered: 02/11/2008),,Jed S. Rakoff,Minute Entry for proceedings held before Judge -NAME- -NAME- -NAME- : Jury Trial held on 1/18/2008 and continued on 1/22/08 . ( ja ) ( Entered : 02/11/2008 ),Minute Entry for proceedings held before Judge : Jury Trial held on 1/18/2008 and continued on 1/22/08 . ( ja ) ( Entered : 02/11/2008 ),minute entry hold jury trial hold continue,,minute entry hold jury trial hold continue,continue,['minute entry hold jury trial hold continued .'],['minute entry hold jury trial hold continued .'],['minute_entry_hold jury_trial_hold continued .'],System Msg,N,
