"Memo-Endorsement on letter addressed to Judge Swain from Alan S. Liebman, dated 4/17/01; reset oral argument of the motion presently scheduled for 4/18/01 to 9:30 4/25/01 (signed by Judge Laura T. Swain ); Copies mailed. (lam) Modified on 04/27/2001 (Entered: 04/27/2001)",,Swain Alan S. Liebman Laura T. Swain,"Memo-Endorsement on letter addressed to Judge -NAME- from -NAME- -NAME- -NAME- , dated 4/17/01 ; reset oral argument of the motion presently scheduled for 4/18/01 to 9:30 4/25/01 ( signed by Judge -NAME- -NAME- -NAME- ) ; Copies mailed . ( lam ) Modified on 04/27/2001 ( Entered : 04/27/2001 )","Memo-Endorsement on letter addressed to Judge from , dated 4/17/01 ; reset oral argument of the motion presently scheduled for 4/18/01 to 9:30 4/25/01 ( signed by Judge ) ; Copies mailed . ( lam ) Modified on 04/27/2001 ( Entered : 04/27/2001 )",memoendorsement letter address reset oral argument motion presently schedule,,memoendorsement letter address reset oral argument motion presently schedule,memoendorsement letter_address reset oral_argument motion presently schedule,"['memoendorsement letter address reset oral argument motion presently schedule .', '']","['memoendorsement letter address reset oral argument motion presently schedule .', '']","['memoendorsement letter_address reset oral_argument motion presently schedule .', '']",Court's Order,Y,Triage
"Memo-Endorsement on letter addressed to Judge Swain from Robert S. Loigman, dated 5/10/01, reset plntf's brief, of up to 15 pages due for 5/30/01 ( signed by Judge Laura T. Swain ); Copies mailed. (cd) (Entered: 05/16/2001)",,Swain Robert S. Loigman Laura T. Swain,"Memo-Endorsement on letter addressed to Judge -NAME- from -NAME- -NAME- -NAME- , dated 5/10/01 , reset plntf 's brief , of up to 15 pages due for 5/30/01 ( signed by Judge -NAME- -NAME- -NAME- ) ; Copies mailed . ( cd ) ( Entered : 05/16/2001 )","Memo-Endorsement on letter addressed to Judge from , dated 5/10/01 , reset plntf 's brief , of up to 15 pages due for 5/30/01 ( signed by Judge ) ; Copies mailed . ( cd ) ( Entered : 05/16/2001 )",memoendorsement letter address reset plntf brief due,,memoendorsement letter address reset plntf brief due,memoendorsement letter_address reset plntf brief due,['memoendorsement letter address reset plntf brief due .'],['memoendorsement letter address reset plntf brief due .'],['memoendorsement letter_address reset plntf brief due .'],Court's Order,Y,Triage
"ORDER, substituting Ganfer & Shore, LLP in place of Warshaw Burstein Cohen Schlesinger & Kuh, LLP as counsel for Rosalie Stahl . ( signed by Judge Laura T. Swain ); Copies mailed. (kw) (Entered: 08/24/2001)",Ganfer & Shore LLP Warshaw Burstein Cohen Schlesinger & Kuh,Rosalie Stahl Laura T. Swain,"ORDER , substituting -ORG- -ORG- -ORG- , -ORG- in place of -ORG- -ORG- -ORG- -ORG- -ORG- -ORG- , LLP as counsel for -NAME- -NAME- . ( signed by Judge -NAME- -NAME- -NAME- ) ; Copies mailed . ( kw ) ( Entered : 08/24/2001 )","ORDER , substituting , in place of , LLP as counsel for . ( signed by Judge ) ; Copies mailed . ( kw ) ( Entered : 08/24/2001 )",order substitute place llp,,order substitute place llp,order substitute place llp,"['order substitute place llp .', '.']","['order substitute place llp .', '.']","['order substitute place llp .', '.']",Court's Order,Y,Triage
"ORDER, that on 11/21/01, an Opinion and Order was issued in this case by the undersigned. The cover page of the Opinion and Order is hereby changed to read in the form attached as Exhibit A . ( signed by Judge Laura T. Swain ); Copies mailed. (tp) (Entered: 12/03/2001)",,Laura T. Swain,"ORDER , that on 11/21/01 , an Opinion and Order was issued in this case by the undersigned . The cover page of the Opinion and Order is hereby changed to read in the form attached as Exhibit A . ( signed by Judge -NAME- -NAME- -NAME- ) ; Copies mailed . ( tp ) ( Entered : 12/03/2001 )","ORDER , that on 11/21/01 , an Opinion and Order was issued in this case by the undersigned . The cover page of the Opinion and Order is hereby changed to read in the form attached as Exhibit A . ( signed by Judge ) ; Copies mailed . ( tp ) ( Entered : 12/03/2001 )",order opinion order undersigned cover opinion order change read,,order opinion order undersigned cover opinion order change read,order opinion order undersigned cover opinion order change read,"['order opinion order issue undersigned .', 'cover opinion order change read .', '.']","['order opinion order issue undersigned .', 'cover opinion order change read .', '.']","['order opinion order issue undersigned .', 'cover opinion order change read .', '.']",Court's Order,Y,Triage
"Pre-Conferene Statement by Daniel Z. Nelson, Lloyd Zeiderman, Harold Greenberg, Rosalie Stahl, Scott G. Savastano, Newvest Capital Corp, Newvest Portfolio, Newvest 96-B . Received in night deposit box on 2/1/02 at 7:53 p.m. (yv) Modified on 02/05/2002 (Entered: 02/05/2002)",Newvest Capital Corp,Daniel Z. Nelson Lloyd Zeiderman Harold Greenberg Rosalie Stahl Scott G. Savastano,"Pre-Conferene Statement by -NAME- -NAME- -NAME- , -NAME- -NAME- , -NAME- -NAME- , -NAME- -NAME- , -NAME- -NAME- -NAME- , -ORG- -ORG- -ORG- , Newvest Portfolio , Newvest 96-B . Received in night deposit box on 2/1/02 at 7:53 p.m. ( yv ) Modified on 02/05/2002 ( Entered : 02/05/2002 )","Pre-Conferene Statement by , , , , , , Newvest Portfolio , Newvest 96-B . Received in night deposit box on 2/1/02 at 7:53 p.m. ( yv ) Modified on 02/05/2002 ( Entered : 02/05/2002 )",preconferene newvest portfolio newvest receive night deposit box p,,preconferene newvest portfolio newvest receive night deposit box p,preconferene newvest portfolio newvest receive night deposit box p,"['preconferene newvest portfolio newvest .', 'receive night deposit box']","['preconferene newvest portfolio newvest .', 'receive night deposit box']","['preconferene newvest portfolio newvest .', 'receive night deposit box']",System Msg,N,
Defendant's initial disclosures pursuant to Rule 26(a)(1) of the FRCP by Rosalie Stahl. (db) (Entered: 02/28/2002),,Rosalie Stahl,Defendant 's initial disclosures pursuant to Rule 26 ( a ) ( 1 ) of the FRCP by -NAME- -NAME- . ( db ) ( Entered : 02/28/2002 ),Defendant 's initial disclosures pursuant to Rule 26 ( a ) ( 1 ) of the FRCP by . ( db ) ( Entered : 02/28/2002 ),initial disclosure rule,,initial disclosure rule,initial disclosure rule,['initial disclosure rule .'],['initial disclosure rule .'],['initial disclosure rule .'],Discovery,Y,Triage
"Memo-Endorsement on letter addressed to Judge Swain from Darlene Fairman, dated 6/18/02, the Court is referring discovery disputes in this matter to Mag Judge Maas. The parties shall contact Judge Maas' chambers for instructions as to how to proceed ( signed by Judge Laura T. Swain ); Copies mailed. (cd) (Entered: 07/02/2002)",Court,Swain Darlene Fairman Maas Maas Laura T. Swain,"Memo-Endorsement on letter addressed to Judge -NAME- from -NAME- -NAME- , dated 6/18/02 , the -ORG- is referring discovery disputes in this matter to Mag Judge -NAME- . The parties shall contact Judge -NAME- ' chambers for instructions as to how to proceed ( signed by Judge -NAME- -NAME- -NAME- ) ; Copies mailed . ( cd ) ( Entered : 07/02/2002 )","Memo-Endorsement on letter addressed to Judge from , dated 6/18/02 , the is referring discovery disputes in this matter to Mag Judge . The parties shall contact Judge ' chambers for instructions as to how to proceed ( signed by Judge ) ; Copies mailed . ( cd ) ( Entered : 07/02/2002 )",memoendorsement letter address discovery dispute mag contact instruction proceed,,memoendorsement letter address discovery dispute mag contact instruction proceed,memoendorsement letter_address discovery dispute mag contact instruction proceed,"['memoendorsement letter address discovery dispute mag .', 'contact instruction proceed .']","['memoendorsement letter address discovery dispute mag .', 'contact instruction proceed .']","['memoendorsement letter_address discovery dispute mag .', 'contact instruction proceed .']",Court's Order,Y,Triage
Order that case be referred to the Clerk of Court for assignment to a Magistrate Judge for Discovery Disputes. Referred to Magistrate Judge Frank Maas. ( signed by Judge Laura T. Swain ) (jco) (Entered: 07/10/2002),Clerk of Court,Frank Maas Laura T. Swain,Order that case be referred to the -ORG- -ORG- -ORG- for assignment to a Magistrate Judge for Discovery Disputes . Referred to Magistrate Judge -NAME- -NAME- . ( signed by Judge -NAME- -NAME- -NAME- ) ( jco ) ( Entered : 07/10/2002 ),Order that case be referred to the for assignment to a Magistrate Judge for Discovery Disputes . Referred to Magistrate Judge . ( signed by Judge ) ( jco ) ( Entered : 07/10/2002 ),order assignment discovery dispute,,order assignment discovery dispute,order assignment discovery dispute,"['order assignment discovery dispute .', '.']","['order assignment discovery dispute .', '.']","['order assignment discovery dispute .', '.']",Court's Order,Y,Triage
"CONFIDENTIALITY AGREEEMENT AND ORDER; regarding procedures that will govern the handling of ""confidential materials"" . ( signed by Judge Laura T. Swain ); Copies mailed. (pl) (Entered: 07/25/2002)",,Laura T. Swain,CONFIDENTIALITY AGREEEMENT AND ORDER ; regarding procedures that will govern the handling of `` confidential materials '' . ( signed by Judge -NAME- -NAME- -NAME- ) ; Copies mailed . ( pl ) ( Entered : 07/25/2002 ),CONFIDENTIALITY AGREEEMENT AND ORDER ; regarding procedures that will govern the handling of `` confidential materials '' . ( signed by Judge ) ; Copies mailed . ( pl ) ( Entered : 07/25/2002 ),confidentiality agreeement order procedure govern handle confidential,,confidentiality agreeement order procedure govern handle confidential,confidentiality agreeement order procedure_govern_handle_confidential,"['confidentiality agreeement order procedure govern handle confidential .', '.']","['confidentiality agreeement order procedure govern handle confidential .', '.']","['confidentiality agreeement order procedure_govern_handle_confidential .', '.']",Court's Order,Y,Triage
"ORDER; On or before 11/15/02, Plaintiffs shall submit to Defendants a sworn statement from Mr. Greenberg's principal treating physician addressing the issue of whether Mr. Greenberg can be deposed, and if so, under what circumstances. NewVest shall promptly update its production of the transaction registers through February 1999 ; ( signed by Magistrate Judge Frank Maas ); Copies forwarded by Chambers; (djc) (Entered: 11/12/2002)",Chambers,Greenberg Greenberg Frank Maas,"ORDER ; On or before 11/15/02 , Plaintiffs shall submit to Defendants a sworn statement from Mr. -NAME- 's principal treating physician addressing the issue of whether Mr. -NAME- can be deposed , and if so , under what circumstances . NewVest shall promptly update its production of the transaction registers through February 1999 ; ( signed by Magistrate Judge -NAME- -NAME- ) ; Copies forwarded by -ORG- ; ( djc ) ( Entered : 11/12/2002 )","ORDER ; On or before 11/15/02 , Plaintiffs shall submit to Defendants a sworn statement from Mr. 's principal treating physician addressing the issue of whether Mr. can be deposed , and if so , under what circumstances . NewVest shall promptly update its production of the transaction registers through February 1999 ; ( signed by Magistrate Judge ) ; Copies forwarded by ; ( djc ) ( Entered : 11/12/2002 )",order swear mr principal treat physician address mr depose circumstance newvest promptly update production transaction register forward,,order swear mr principal treat physician address mr depose circumstance newvest promptly update production transaction register forward,order swear mr principal treat physician address mr depose circumstance newvest promptly update production transaction register forward,"['order swear principal treat physician address issue depose circumstance .', 'newvest promptly update production transaction register forward']","['order swear principal treat physician address issue depose circumstance .', 'newvest promptly update production transaction register forward']","['order swear principal treat physician address issue depose circumstance .', 'newvest promptly update production transaction register forward']",Court's Order,Y,Triage
"Memo-Endorsement on letter addressed to Judge Swain from Mark A. Berman, dated 11/7/02. Reset discovery due for 1/31/03 . ( signed by Judge Laura T. Swain ); Copies faxed by Chambers. (kw) (Entered: 11/20/2002)",Chambers,Swain Mark A. Berman Laura T. Swain,"Memo-Endorsement on letter addressed to Judge -NAME- from -NAME- -NAME- -NAME- , dated 11/7/02 . Reset discovery due for 1/31/03 . ( signed by Judge -NAME- -NAME- -NAME- ) ; Copies faxed by -ORG- . ( kw ) ( Entered : 11/20/2002 )","Memo-Endorsement on letter addressed to Judge from , dated 11/7/02 . Reset discovery due for 1/31/03 . ( signed by Judge ) ; Copies faxed by . ( kw ) ( Entered : 11/20/2002 )",memoendorsement letter address reset discovery due fax,,memoendorsement letter address reset discovery due fax,memoendorsement letter_address reset discovery due fax,"['memoendorsement letter address .', 'reset discovery due .', 'fax .']","['memoendorsement letter address .', 'reset discovery due .', 'fax .']","['memoendorsement letter_address .', 'reset discovery due .', 'fax .']",Court's Order,Y,Triage
Case closed. (kw) (Entered: 01/22/2003),,,Case closed . ( kw ) ( Entered : 01/22/2003 ),Case closed . ( kw ) ( Entered : 01/22/2003 ),,,,,['.'],['.'],['.'],System Msg,N,
"CIVIL COVER SHEET filed. (Scileppi, Laura) (Entered: 06/20/2017)",,Laura,"CIVIL COVER SHEET filed . ( Scileppi , -NAME- ) ( Entered : 06/20/2017 )","CIVIL COVER SHEET filed . ( Scileppi , ) ( Entered : 06/20/2017 )",civil cover sheet,,civil cover sheet,civil_cover_sheet,['civil cover sheet file .'],['civil cover sheet file .'],['civil_cover_sheet file .'],System Msg,N,
Magistrate Judge Debra C. Freeman is so designated. Pursuant to 28 U.S.C. Section 636(c) and Fed. R. Civ. P. 73(b)(1) parties are notified that they may consent to proceed before a United States Magistrate Judge. Parties who wish to consent may access the necessary form at the following link: http://nysd.uscourts.gov/forms.php. (pc) (Entered: 06/21/2017),Fed,Debra C. Freeman,Magistrate Judge -NAME- -NAME- -NAME- is so designated . Pursuant to 28 U.S.C . Section 636 ( c ) and -ORG- . R. Civ . P. 73 ( b ) ( 1 ) parties are notified that they may consent to proceed before a United States Magistrate Judge . Parties who wish to consent may access the necessary form at the following link : http : //nysd.uscourts.gov/forms.php . ( pc ) ( Entered : 06/21/2017 ),Magistrate Judge is so designated . Pursuant to 28 U.S.C . Section 636 ( c ) and . R. Civ . P. 73 ( b ) ( 1 ) parties are notified that they may consent to proceed before a United States Magistrate Judge . Parties who wish to consent may access the necessary form at the following link : http : //nysd.uscourts.gov/forms.php . ( pc ) ( Entered : 06/21/2017 ),u c section r p notify consent proceed united wish consent access necessary link http nysd uscourts gov php,,u c section r p notify consent proceed united wish consent access necessary link http nysd uscourts gov php,u_c section r p notify consent proceed united wish consent access necessary link http nysd uscourts_gov php,"['.', 'u.s.c .', 'section .', '.', 'p. notify consent proceed united state .', 'wish consent access necessary link http nysd.uscourts.govforms.php .']","['.', 'u.s.c .', 'section .', '.', 'p. notify consent proceed united state .', 'wish consent access necessary link http nysd.uscourts.govforms.php .']","['.', 'u.s.c .', 'section .', '.', 'p. notify consent proceed united state .', 'wish consent access necessary link http nysd.uscourts.govforms.php .']",System Msg,N,
Case Designated ECF. (pc) (Entered: 06/21/2017),ECF,,Case Designated -ORG- . ( pc ) ( Entered : 06/21/2017 ),Case Designated . ( pc ) ( Entered : 06/21/2017 ),,,,,['.'],['.'],['.'],System Msg,N,
"AO 121 FORM COPYRIGHT - CASE OPENING - SUBMITTED. In compliance with the provisions of 17 U.S.C. 508, the Register of Copyrights is hereby advised that a court action has been filed on the following copyright(s) in the U.S. District Court Southern District of New York. Form e-mailed to Register of Copyrights. (pc) (Entered: 06/21/2017)",U.S.C U.S. District Court Southern District of New York,,"AO 121 FORM COPYRIGHT - CASE OPENING - SUBMITTED . In compliance with the provisions of 17 -ORG- . 508 , the Register of Copyrights is hereby advised that a court action has been filed on the following copyright ( s ) in the -ORG- -ORG- -ORG- -ORG- -ORG- -ORG- -ORG- -ORG- . Form e-mailed to Register of Copyrights . ( pc ) ( Entered : 06/21/2017 )","AO 121 FORM COPYRIGHT - CASE OPENING - SUBMITTED . In compliance with the provisions of 17 . 508 , the Register of Copyrights is hereby advised that a court action has been filed on the following copyright ( s ) in the . Form e-mailed to Register of Copyrights . ( pc ) ( Entered : 06/21/2017 )",ao copyright open compliance provision register copyright advise copyright email register copyright,,ao copyright open compliance provision register copyright advise copyright email register copyright,ao copyright open compliance provision register copyright advise copyright email register copyright,"['ao copyright open .', 'compliance provision .', 'register copyright advise file copyright .', 'email register copyright .']","['ao copyright open .', 'compliance provision .', 'register copyright advise file copyright .', 'email register copyright .']","['ao copyright open .', 'compliance provision .', 'register copyright advise file copyright .', 'email register copyright .']",System Msg,N,
"CASE REFERRED TO Judge William H. Pauley as possibly related to MDL 1409. (gf, ) (Entered: 07/23/2004)",,William H. Pauley,"CASE REFERRED TO Judge -NAME- -NAME- -NAME- as possibly related to MDL 1409 . ( gf , ) ( Entered : 07/23/2004 )","CASE REFERRED TO Judge as possibly related to MDL 1409 . ( gf , ) ( Entered : 07/23/2004 )",possibly mdl,,possibly mdl,possibly mdl,['possibly mdl .'],['possibly mdl .'],['possibly mdl .'],System Msg,N,
"Magistrate Judge Theodore H. Katz is so designated. (laq, ) (Entered: 08/16/2004)",,Theodore H. Katz,"Magistrate Judge -NAME- -NAME- -NAME- is so designated . ( laq , ) ( Entered : 08/16/2004 )","Magistrate Judge is so designated . ( laq , ) ( Entered : 08/16/2004 )",,,,,['.'],['.'],['.'],System Msg,N,
"RULE 7.1 DISCLOSURE STATEMENT. Document filed by American Express Centurion Bank, American Express Company, American Express Travel Related Services, Inc..(djc, ) (Entered: 09/21/2004)",American Express Centurion Bank American Express Company American Express Travel Related Services,,"RULE 7.1 DISCLOSURE STATEMENT . Document filed by -ORG- -ORG- -ORG- -ORG- , -ORG- -ORG- -ORG- , -ORG- -ORG- -ORG- -ORG- -ORG- , Inc.. ( djc , ) ( Entered : 09/21/2004 )","RULE 7.1 DISCLOSURE STATEMENT . Document filed by , , , Inc.. ( djc , ) ( Entered : 09/21/2004 )",rule disclosure inc,,rule disclosure inc,inc,"['rule disclosure .', 'document file']","['rule disclosure .', 'document file']","['.', 'document file']",System Msg,N,
"RULE 26(f) DISCOVERY PLAN REPORT.Document filed by American Express Centurion Bank, American Express Company, American Express Travel Related Services, Inc..(Jacobson, Jonathan) (Entered: 11/17/2004)",American Express Centurion Bank American Express Company American Express Travel Related Services,Jacobson Jonathan,"RULE 26 ( f ) DISCOVERY PLAN REPORT.Document filed by -ORG- -ORG- -ORG- -ORG- , -ORG- -ORG- -ORG- , -ORG- -ORG- -ORG- -ORG- -ORG- , Inc.. ( -NAME- , -NAME- ) ( Entered : 11/17/2004 )","RULE 26 ( f ) DISCOVERY PLAN REPORT.Document filed by , , , Inc.. ( , ) ( Entered : 11/17/2004 )",rule discovery plan report inc,,rule discovery plan report inc,rule discovery plan report inc,['rule discovery plan report.document file'],['rule discovery plan report.document file'],['rule discovery plan report.document file'],Discovery,Y,Triage
"TRANSCRIPT of proceedings held on 12/8/04 before Judge William H. Pauley III.(Belfiore, John) (Entered: 12/17/2004)",,William H. Pauley III Belfiore John,"TRANSCRIPT of proceedings held on 12/8/04 before Judge -NAME- -NAME- -NAME- -NAME- . ( -NAME- , -NAME- ) ( Entered : 12/17/2004 )","TRANSCRIPT of proceedings held on 12/8/04 before Judge . ( , ) ( Entered : 12/17/2004 )",hold,,hold,hold,['hold .'],['hold .'],['hold .'],Transcript,Y,Triage
"TRANSCRIPT of proceedings held on 12/8/04 before Judge William H. Pauley III.(Gonzalez, Jose) (Entered: 12/17/2004)",,William H. Pauley III ( Gonzalez Jose,"TRANSCRIPT of proceedings held on 12/8/04 before Judge -NAME- -NAME- -NAME- -NAME- . -NAME- -NAME- , -NAME- ) ( Entered : 12/17/2004 )","TRANSCRIPT of proceedings held on 12/8/04 before Judge . , ) ( Entered : 12/17/2004 )",hold,,hold,hold,"['hold .', '']","['hold .', '']","['hold .', '']",Transcript,Y,Triage
"LETTER addressed to Judge Pauley from Jamie Berger dated 12/14/2004 Document filed by American Express Centurion Bank, American Express Company, American Express Travel Related Services, Inc..(jp, ) (Entered: 12/23/2004)",American Express Centurion Bank American Express Company American Express Travel Related Services,Pauley Jamie Berger,"LETTER addressed to Judge -NAME- from -NAME- -NAME- dated 12/14/2004 Document filed by -ORG- -ORG- -ORG- -ORG- , -ORG- -ORG- -ORG- , -ORG- -ORG- -ORG- -ORG- -ORG- , Inc.. ( jp , ) ( Entered : 12/23/2004 )","LETTER addressed to Judge from dated 12/14/2004 Document filed by , , , Inc.. ( jp , ) ( Entered : 12/23/2004 )",letter address inc,,letter address inc,letter_address inc,['letter address document file'],['letter address document file'],['letter_address document file'],Letter to Court,Y,Triage
"LETTER addressed to Judge William H. Pauley, III from Merrill G. Davidoff dated 12/22/04 re: Plaintiffs waive any claim of potential conflict of interest in connection with your Honor's continuing to preside in this matter. Document filed by Robert Ross, Randal Wachsmuth.(ps, ) (Entered: 01/04/2005)",,William H. Pauley Merrill G. Davidoff Robert Ross Randal Wachsmuth,"LETTER addressed to Judge -NAME- -NAME- -NAME- , III from -NAME- -NAME- -NAME- dated 12/22/04 re : Plaintiffs waive any claim of potential conflict of interest in connection with your Honor 's continuing to preside in this matter . Document filed by -NAME- -NAME- , -NAME- -NAME- . ( ps , ) ( Entered : 01/04/2005 )","LETTER addressed to Judge , III from dated 12/22/04 re : Plaintiffs waive any claim of potential conflict of interest in connection with your Honor 's continuing to preside in this matter . Document filed by , . ( ps , ) ( Entered : 01/04/2005 )",letter address waive potential conflict interest connection continue preside,,letter address waive potential conflict interest connection continue preside,letter_address waive potential conflict interest connection continue preside,"['letter address iii waive potential conflict interest connection continue preside .', 'document file .']","['letter address iii waive potential conflict interest connection continue preside .', 'document file .']","['letter_address iii waive potential conflict interest connection continue preside .', 'document file .']",Letter to Court,Y,Triage
"MOTION for Protective Order Motion for Entry of Protective Order. Document filed by American Express Company, American Express Travel Related Services, Inc., American Express Centurion Bank. (Berger, Jamie) (Entered: 03/25/2005)","American Express Company American Express Travel Related Services , Inc. American Express Centurion Bank",( Berger Jamie,"MOTION for Protective Order Motion for Entry of Protective Order . Document filed by -ORG- -ORG- -ORG- , -ORG- -ORG- -ORG- -ORG- -ORG- -ORG- -ORG- , -ORG- -ORG- -ORG- -ORG- . -NAME- -NAME- , -NAME- ) ( Entered : 03/25/2005 )","MOTION for Protective Order Motion for Entry of Protective Order . Document filed by , , . , ) ( Entered : 03/25/2005 )",motion protective order motion entry protective order,,motion protective order motion entry protective order,motion protective order motion entry protective order,"['motion protective order motion entry protective order .', 'document file .', '']","['motion protective order motion entry protective order .', 'document file .', '']","['motion protective order motion entry protective order .', 'document file .', '']",Motion,Y,Triage
"ORDER that the terms of the stipulated confidentiality order entered in MDL 1409 shall apply with full force and effect in the instant case. (Signed by Judge William H. Pauley III on 3/29/05) (dle, ) (Entered: 03/31/2005)",,William H. Pauley III,"ORDER that the terms of the stipulated confidentiality order entered in MDL 1409 shall apply with full force and effect in the instant case . ( Signed by Judge -NAME- -NAME- -NAME- -NAME- on 3/29/05 ) ( dle , ) ( Entered : 03/31/2005 )","ORDER that the terms of the stipulated confidentiality order entered in MDL 1409 shall apply with full force and effect in the instant case . ( Signed by Judge on 3/29/05 ) ( dle , ) ( Entered : 03/31/2005 )",order term stipulate confidentiality order mdl apply full force effect instant,,order term stipulate confidentiality order mdl apply full force effect instant,order term stipulate confidentiality order mdl apply full force effect instant,['order term stipulate confidentiality order mdl apply full force effect instant .'],['order term stipulate confidentiality order mdl apply full force effect instant .'],['order term stipulate confidentiality order mdl apply full force effect instant .'],Court's Order,Y,Triage
