"ORDER REGARDING PROTOCOL FOR THE PRODUCTION OF DATA. (Signed by Judge Denise L. Cote (S.D.N.Y.), Judge George H. Wu (C.D. Cal.), Judge John W. Lungstrum (D. Kan.), Magistrate Judge James P. OHara (D. Kan.) on 4/9/2014)(gr) (Entered: 04/09/2014)",,Denise L. Cote George H. Wu John W. Lungstrum James P. OHara,"ORDER REGARDING PROTOCOL FOR THE PRODUCTION OF DATA . ( Signed by Judge -NAME- -NAME- -NAME- ( S.D.N.Y . ) , Judge -NAME- -NAME- -NAME- ( C.D . Cal . ) , Judge -NAME- -NAME- -NAME- ( D. Kan. ) , Magistrate Judge -NAME- -NAME- -NAME- ( D. Kan. ) on 4/9/2014 ) ( gr ) ( Entered : 04/09/2014 )","ORDER REGARDING PROTOCOL FOR THE PRODUCTION OF DATA . ( Signed by Judge ( S.D.N.Y . ) , Judge ( C.D . Cal . ) , Judge ( D. Kan. ) , Magistrate Judge ( D. Kan. ) on 4/9/2014 ) ( gr ) ( Entered : 04/09/2014 )",order production data,,order production data,order production data,"['order protocol production data .', '']","['order protocol production data .', '']","['order protocol production data .', '']",Court's Order,Y,Triage
"MASTER PROTECTIVE ORDER.(Signed by Judge Denise L. Cote (S.D.N.Y.), Judge George H. Wu (C.D. Cal.), Judge John W. Lungstrum (D. Kan.), Magistrate Judge James P. OHara (D. Kan.) on 4/9/2014) (gr) (Entered: 04/09/2014)",,Denise L. Cote George H. Wu John W. Lungstrum James P. OHara,"MASTER PROTECTIVE ORDER . ( Signed by Judge -NAME- -NAME- -NAME- ( S.D.N.Y . ) , Judge -NAME- -NAME- -NAME- ( C.D . Cal . ) , Judge -NAME- -NAME- -NAME- ( D. Kan. ) , Magistrate Judge -NAME- -NAME- -NAME- ( D. Kan. ) on 4/9/2014 ) ( gr ) ( Entered : 04/09/2014 )","MASTER PROTECTIVE ORDER . ( Signed by Judge ( S.D.N.Y . ) , Judge ( C.D . Cal . ) , Judge ( D. Kan. ) , Magistrate Judge ( D. Kan. ) on 4/9/2014 ) ( gr ) ( Entered : 04/09/2014 )",protective order,,protective order,protective order,"['protective order .', '']","['protective order .', '']","['protective order .', '']",Court's Order,Y,Triage
"STATUS REPORT. NCUA Report on Informal Discovery Document filed by National Credit Union Administration Board. (Attachments: # 1 Exhibit A, # 2 Exhibit B, # 3 Exhibit C, # 4 Exhibit D)(Haas, Erik) (Entered: 04/18/2014)",NCUA National Credit Union Administration Board,Erik,"STATUS REPORT . -ORG- Report on Informal Discovery Document filed by -ORG- -ORG- -ORG- -ORG- -ORG- . ( Attachments : # 1 Exhibit A , # 2 Exhibit B , # 3 Exhibit C , # 4 Exhibit D ) ( Haas , -NAME- ) ( Entered : 04/18/2014 )","STATUS REPORT . Report on Informal Discovery Document filed by . ( Attachments : # 1 Exhibit A , # 2 Exhibit B , # 3 Exhibit C , # 4 Exhibit D ) ( Haas , ) ( Entered : 04/18/2014 )",status report report informal discovery,,status report report informal discovery,status_report report informal discovery,"['status report .', 'report informal discovery document file .']","['status report .', 'report informal discovery document file .']","['status_report .', 'report informal discovery document file .']",Letter to Court,Y,Triage
"STATUS REPORT. re the parties' negotiations with respect to NCUA's discovery of Credit Suisse Document filed by Credit Suisse First Boston Mortgage Securities Corp., Credit Suisse Securities (USA) LLC. (Attachments: # 1 Exhibit A, # 2 Exhibit B, # 3 Exhibit C)(Moskowitz, Lauren) (Entered: 04/18/2014)",NCUA Credit Suisse First Boston Mortgage Securities Corp. Credit Suisse Securities ( USA ) LLC,Moskowitz Lauren,"STATUS REPORT . re the parties ' negotiations with respect to -ORG- 's discovery of Credit Suisse Document filed by -ORG- -ORG- -ORG- -ORG- -ORG- -ORG- -ORG- , -ORG- -ORG- -ORG- -ORG- -ORG- -ORG- -ORG- . ( Attachments : # 1 Exhibit A , # 2 Exhibit B , # 3 Exhibit C ) ( -NAME- , -NAME- ) ( Entered : 04/18/2014 )","STATUS REPORT . re the parties ' negotiations with respect to 's discovery of Credit Suisse Document filed by , . ( Attachments : # 1 Exhibit A , # 2 Exhibit B , # 3 Exhibit C ) ( , ) ( Entered : 04/18/2014 )",status report negotiation discovery credit suisse,,status report negotiation discovery credit suisse,status_report negotiation discovery credit suisse,"['status report .', 'negotiation discovery credit suisse document file .']","['status report .', 'negotiation discovery credit suisse document file .']","['status_report .', 'negotiation discovery credit suisse document file .']",Letter to Court,Y,Triage
"LETTER addressed to Judge Denise L. Cote from James P. Rouhandeh dated April 18, 2014 re: Discovery Disputes with NCUA common to all Defendants. Document filed by Credit Suisse First Boston Mortgage Securities Corp., Credit Suisse Securities (USA) LLC.(Rouhandeh, James) (Entered: 04/18/2014)",NCUA Credit Suisse First Boston Mortgage Securities Corp. Credit Suisse Securities ( USA ) LLC,Denise L. Cote James P. Rouhandeh ( Rouhandeh James,"LETTER addressed to Judge -NAME- -NAME- -NAME- from -NAME- -NAME- -NAME- dated April 18 , 2014 re : Discovery Disputes with -ORG- common to all Defendants . Document filed by -ORG- -ORG- -ORG- -ORG- -ORG- -ORG- -ORG- , -ORG- -ORG- -ORG- -ORG- -ORG- -ORG- -ORG- . -NAME- -NAME- , -NAME- ) ( Entered : 04/18/2014 )","LETTER addressed to Judge from dated April 18 , 2014 re : Discovery Disputes with common to all Defendants . Document filed by , . , ) ( Entered : 04/18/2014 )",letter address discovery dispute common,,letter address discovery dispute common,letter_address discovery dispute common,"['letter address discovery dispute common .', 'document file .', '']","['letter address discovery dispute common .', 'document file .', '']","['letter_address discovery dispute common .', 'document file .', '']",Letter to Court,Y,Triage
"ORDER...[T]he parties shall continue the meet-and-confer process for the next two weeks and seek to resolve or narrow outstanding disputes as to all issues in all actions. A report shall be due by May 2, 2014. IT IS FURTHER ORDERED that defendant NovaStar shall promptly engage in this meet-and-confer process in a good faith effort to reach agreement with NCUA or to narrow any areas of disagreement by May 2, 2014. IT IS FURTHER ORDERED that the May 2, 2014 submissions shall supersede the April 18, 2014 submissions, and thus need not refer to the April 18 submissions. IT IS FURTHER ORDERED that, pursuant to the April 9, 2014 Master Discovery Protocol, all applications and disputes regarding discovery in these actions will be filed in the lead case pending in the Southern District of New York (currently 13 Civ. 6705). If the application or dispute applies to fewer than all actions, then the submission should be filed as well in the action or actions to which it applies. (Signed by Judge Denise L. Cote, Coordination Judge in these NCUA Actions on 4/22/2014) (gr) Modified on 4/22/2014 (gr). (Entered: 04/22/2014)",NovaStar NCUA Southern District of New York NCUA,Denise L. Cote,"ORDER ... [ T ] he parties shall continue the meet-and-confer process for the next two weeks and seek to resolve or narrow outstanding disputes as to all issues in all actions . A report shall be due by May 2 , 2014 . IT IS FURTHER ORDERED that defendant -ORG- shall promptly engage in this meet-and-confer process in a good faith effort to reach agreement with -ORG- or to narrow any areas of disagreement by May 2 , 2014 . IT IS FURTHER ORDERED that the May 2 , 2014 submissions shall supersede the April 18 , 2014 submissions , and thus need not refer to the April 18 submissions . IT IS FURTHER ORDERED that , pursuant to the April 9 , 2014 Master Discovery Protocol , all applications and disputes regarding discovery in these actions will be filed in the lead case pending in the -ORG- -ORG- -ORG- -ORG- -ORG- ( currently 13 Civ . 6705 ) . If the application or dispute applies to fewer than all actions , then the submission should be filed as well in the action or actions to which it applies . ( Signed by Judge -NAME- -NAME- -NAME- , Coordination Judge in these -ORG- Actions on 4/22/2014 ) ( gr ) Modified on 4/22/2014 ( gr ) . ( Entered : 04/22/2014 )","ORDER ... [ T ] he parties shall continue the meet-and-confer process for the next two weeks and seek to resolve or narrow outstanding disputes as to all issues in all actions . A report shall be due by May 2 , 2014 . IT IS FURTHER ORDERED that defendant shall promptly engage in this meet-and-confer process in a good faith effort to reach agreement with or to narrow any areas of disagreement by May 2 , 2014 . IT IS FURTHER ORDERED that the May 2 , 2014 submissions shall supersede the April 18 , 2014 submissions , and thus need not refer to the April 18 submissions . IT IS FURTHER ORDERED that , pursuant to the April 9 , 2014 Master Discovery Protocol , all applications and disputes regarding discovery in these actions will be filed in the lead case pending in the ( currently 13 Civ . 6705 ) . If the application or dispute applies to fewer than all actions , then the submission should be filed as well in the action or actions to which it applies . ( Signed by Judge , Coordination Judge in these Actions on 4/22/2014 ) ( gr ) Modified on 4/22/2014 ( gr ) . ( Entered : 04/22/2014 )",order continue meetandconfer process next week resolve narrow outstanding dispute report due order promptly engage meetandconfer process good faith effort reach narrow area disagreement order supersede thus need order discovery dispute discovery lead dispute apply few well applies,,order continue meetandconfer process next week resolve narrow outstanding dispute report due order promptly engage meetandconfer process good faith effort reach narrow area disagreement order supersede thus need order discovery dispute discovery lead dispute apply few well applies,order continue meetandconfer process next week resolve narrow outstanding dispute report due order promptly engage meetandconfer process good faith effort reach narrow area disagreement order supersede thus need order discovery dispute discovery lead dispute apply few well applies,"['order continue meetandconfer process next week resolve narrow outstanding dispute issue .', 'report due .', 'order promptly engage meetandconfer process good faith effort reach narrow area disagreement .', 'order supersede thus need .', 'order discovery protocol application dispute discovery file lead .', 'application dispute apply few file well applies .', '.']","['order continue meetandconfer process next week resolve narrow outstanding dispute issue .', 'report due .', 'order promptly engage meetandconfer process good faith effort reach narrow area disagreement .', 'order supersede thus need .', 'order discovery protocol application dispute discovery file lead .', 'application dispute apply few file well applies .', '.']","['order continue meetandconfer process next week resolve narrow outstanding dispute issue .', 'report due .', 'order promptly engage meetandconfer process good faith effort reach narrow area disagreement .', 'order supersede thus need .', 'order discovery protocol application dispute discovery file lead .', 'application dispute apply few file well applies .', '.']",Court's Order,Y,Triage
"FILING ERROR - DEFICIENT DOCKET ENTRY(ORIGINAL FILED IN 13 Civ.6705, DOCUMENT#89) - LETTER addressed to Judge Denise L. Cote from James P. Rouhandeh dated April 25, 2014 re: clarification regarding two provisions of the Master Discovery Protocol. Document filed by Credit Suisse First Boston Mortgage Securities Corp., Credit Suisse Securities (USA) LLC.(Rouhandeh, James) Modified on 4/28/2014 (ka). (Entered: 04/25/2014)",Credit Suisse First Boston Mortgage Securities Corp. Credit Suisse Securities ( USA ) LLC,Denise L. Cote James P. Rouhandeh ( Rouhandeh James,"FILING ERROR - DEFICIENT DOCKET ENTRY ( ORIGINAL FILED IN 13 Civ.6705 , DOCUMENT # 89 ) - LETTER addressed to Judge -NAME- -NAME- -NAME- from -NAME- -NAME- -NAME- dated April 25 , 2014 re : clarification regarding two provisions of the Master Discovery Protocol . Document filed by -ORG- -ORG- -ORG- -ORG- -ORG- -ORG- -ORG- , -ORG- -ORG- -ORG- -ORG- -ORG- -ORG- -ORG- . -NAME- -NAME- , -NAME- ) Modified on 4/28/2014 ( ka ) . ( Entered : 04/25/2014 )","FILING ERROR - DEFICIENT DOCKET ENTRY ( ORIGINAL FILED IN 13 Civ.6705 , DOCUMENT # 89 ) - LETTER addressed to Judge from dated April 25 , 2014 re : clarification regarding two provisions of the Master Discovery Protocol . Document filed by , . , ) Modified on 4/28/2014 ( ka ) . ( Entered : 04/25/2014 )",deficient entry letter address clarification provision discovery,,deficient entry letter address clarification provision discovery,deficient entry letter_address clarification provision discovery,"['file error deficient entry letter address clarification provision discovery protocol .', 'document file .', '.']","['file error deficient entry letter address clarification provision discovery protocol .', 'document file .', '.']","['file error deficient entry letter_address clarification provision discovery protocol .', 'document file .', '.']",System Msg,N,
"LETTER addressed to Judge Denise L. Cote from David C. Frederick dated April 28, 2014 re: Defendants' April 25, 2014 letter regarding NCUA's Motion in Limine to Admit Expert Statistical Sampling Testimony. Document filed by National Credit Union Administration Board.(Haas, Erik) (Entered: 04/28/2014)",NCUA National Credit Union Administration Board,Denise L. Cote David C. Frederick Erik,"LETTER addressed to Judge -NAME- -NAME- -NAME- from -NAME- -NAME- -NAME- dated April 28 , 2014 re : Defendants ' April 25 , 2014 letter regarding -ORG- 's Motion in Limine to Admit Expert Statistical Sampling Testimony . Document filed by -ORG- -ORG- -ORG- -ORG- -ORG- . ( Haas , -NAME- ) ( Entered : 04/28/2014 )","LETTER addressed to Judge from dated April 28 , 2014 re : Defendants ' April 25 , 2014 letter regarding 's Motion in Limine to Admit Expert Statistical Sampling Testimony . Document filed by . ( Haas , ) ( Entered : 04/28/2014 )",letter address letter motion limine admit statistical sample testimony,,letter address letter motion limine admit statistical sample testimony,letter_address letter motion_limine admit statistical sample testimony,"['letter address letter motion limine admit statistical sampling testimony .', 'document file .']","['letter address letter motion limine admit statistical sampling testimony .', 'document file .']","['letter_address letter motion_limine admit statistical sampling testimony .', 'document file .']",Letter to Court,Y,Triage
ORDER RE: ADMISSION OF EXPERT STATISTICAL SAMPLING TESTIMONY. (Signed by Judge Denise L. Cote on 4/30/2014) (gr) (Entered: 04/30/2014),,Denise L. Cote,ORDER RE : ADMISSION OF EXPERT STATISTICAL SAMPLING TESTIMONY . ( Signed by Judge -NAME- -NAME- -NAME- on 4/30/2014 ) ( gr ) ( Entered : 04/30/2014 ),ORDER RE : ADMISSION OF EXPERT STATISTICAL SAMPLING TESTIMONY . ( Signed by Judge on 4/30/2014 ) ( gr ) ( Entered : 04/30/2014 ),order admission statistical sampling testimony,,order admission statistical sampling testimony,order admission statistical sampling testimony,['order admission statistical sample testimony .'],['order admission statistical sample testimony .'],['order admission statistical sample testimony .'],Court's Order,Y,Triage
"STATUS REPORT. dated May 2, 2014 re the parties' negotiations with respect to NCUA's discovery of Credit Suisse Document filed by Credit Suisse First Boston Mortgage Securities Corp., Credit Suisse Securities (USA) LLC. (Attachments: # 1 Exhibit A, # 2 Exhibit B)(Moskowitz, Lauren) (Entered: 05/02/2014)",NCUA Credit Suisse First Boston Mortgage Securities Corp. Credit Suisse Securities ( USA ) LLC,Moskowitz Lauren,"STATUS REPORT . dated May 2 , 2014 re the parties ' negotiations with respect to -ORG- 's discovery of Credit Suisse Document filed by -ORG- -ORG- -ORG- -ORG- -ORG- -ORG- -ORG- , -ORG- -ORG- -ORG- -ORG- -ORG- -ORG- -ORG- . ( Attachments : # 1 Exhibit A , # 2 Exhibit B ) ( -NAME- , -NAME- ) ( Entered : 05/02/2014 )","STATUS REPORT . dated May 2 , 2014 re the parties ' negotiations with respect to 's discovery of Credit Suisse Document filed by , . ( Attachments : # 1 Exhibit A , # 2 Exhibit B ) ( , ) ( Entered : 05/02/2014 )",status report negotiation discovery credit suisse,,status report negotiation discovery credit suisse,status_report negotiation discovery credit suisse,"['status report .', 'negotiation discovery credit suisse document file .']","['status report .', 'negotiation discovery credit suisse document file .']","['status_report .', 'negotiation discovery credit suisse document file .']",Letter to Court,Y,Triage
"ORDER TO SHOW CAUSE: Some of the defendants in these related actions have presented an affirmative defense based on NCUA's alleged failure to name parties that may be indispensable. (See Order for examples). Accordingly, it is hereby ORDERED that any party may show cause by June 13, 2014 why this Court should not set a deadline of July 11, 2014 to join other parties in these actions. IT IS FURTHER ORDERED that any submissions shall be limited to a 2-page single-spaced letter. (Signed by Judge Denise L. Cote on 6/2/2014) (gr) (Entered: 06/02/2014)",NCUA,Denise L. Cote,"ORDER TO SHOW CAUSE : Some of the defendants in these related actions have presented an affirmative defense based on -ORG- 's alleged failure to name parties that may be indispensable . ( See Order for examples ) . Accordingly , it is hereby ORDERED that any party may show cause by June 13 , 2014 why this Court should not set a deadline of July 11 , 2014 to join other parties in these actions . IT IS FURTHER ORDERED that any submissions shall be limited to a 2-page single-spaced letter . ( Signed by Judge -NAME- -NAME- -NAME- on 6/2/2014 ) ( gr ) ( Entered : 06/02/2014 )","ORDER TO SHOW CAUSE : Some of the defendants in these related actions have presented an affirmative defense based on 's alleged failure to name parties that may be indispensable . ( See Order for examples ) . Accordingly , it is hereby ORDERED that any party may show cause by June 13 , 2014 why this Court should not set a deadline of July 11 , 2014 to join other parties in these actions . IT IS FURTHER ORDERED that any submissions shall be limited to a 2-page single-spaced letter . ( Signed by Judge on 6/2/2014 ) ( gr ) ( Entered : 06/02/2014 )",order show cause affirmative defense base alleged failure name indispensable order show cause deadline join order limit singlespaced letter,,order show cause affirmative defense base alleged failure name indispensable order show cause deadline join order limit singlespaced letter,order show_cause affirmative defense base alleged failure name indispensable order show_cause deadline join order limit singlespaced letter,"['order show cause affirmative defense base alleged failure name indispensable .', '.', 'order show cause deadline join .', 'ordered limit singlespaced letter .']","['order show cause affirmative defense base alleged failure name indispensable .', '.', 'order show cause deadline join .', 'ordered limit singlespaced letter .']","['order show_cause affirmative defense base alleged failure name indispensable .', '.', 'order show_cause deadline join .', 'ordered limit singlespaced letter .']",Motion,Y,Triage
"ORDER: Having reviewed the May 30 submissions...(See Order) Signed by Judge Denise L. Cote (S.D.N.Y.), Judge George H. Wu (C.D. Cal.), Judge John W. Lungstrum (D. Kan.), Magistrate Judge James P. OHara (D. Kan.) (gr) Modified on 6/4/2014 (gr). (Entered: 06/04/2014)",,Denise L. Cote George H. Wu John W. Lungstrum James P. OHara,"ORDER : Having reviewed the May 30 submissions ... ( See Order ) Signed by Judge -NAME- -NAME- -NAME- ( S.D.N.Y . ) , Judge -NAME- -NAME- -NAME- ( C.D . Cal . ) , Judge -NAME- -NAME- -NAME- ( D. Kan. ) , Magistrate Judge -NAME- -NAME- -NAME- ( D. Kan. ) ( gr ) Modified on 6/4/2014 ( gr ) . ( Entered : 06/04/2014 )","ORDER : Having reviewed the May 30 submissions ... ( See Order ) Signed by Judge ( S.D.N.Y . ) , Judge ( C.D . Cal . ) , Judge ( D. Kan. ) , Magistrate Judge ( D. Kan. ) ( gr ) Modified on 6/4/2014 ( gr ) . ( Entered : 06/04/2014 )",order,,order,order,['order reviewed .'],['order reviewed .'],['order reviewed .'],Court's Order,Y,Triage
"ORDER. NCUA and Goldman Sachs shall confer regarding the least burdensome way, which is still effective, for Goldman Sachs to locate and produce the above-described documents for the relevant approximately 33% of loans underlying the securitization in question. Any remaining dispute shall be presented to the Court by June 13, 2014. IT IS FURTHER ORDERED that NCUA shall re-file its letter of June 6 without redactions. Signed by Judge Denise L. Cote (S.D.N.Y.), Judge George H. Wu (C.D. Cal.), Judge John W. Lungstrum (D. Kan.), Magistrate Judge James P. OHara (D. Kan.)on 6/10/2014) (gr) (Entered: 06/10/2014)",NCUA Goldman Sachs Goldman Sachs NCUA,Denise L. Cote George H. Wu John W. Lungstrum James P. OHara,"ORDER . -ORG- and -ORG- -ORG- shall confer regarding the least burdensome way , which is still effective , for -ORG- -ORG- to locate and produce the above-described documents for the relevant approximately 33 % of loans underlying the securitization in question . Any remaining dispute shall be presented to the Court by June 13 , 2014 . IT IS FURTHER ORDERED that -ORG- shall re-file its letter of June 6 without redactions . Signed by Judge -NAME- -NAME- -NAME- ( S.D.N.Y . ) , Judge -NAME- -NAME- -NAME- ( C.D . Cal . ) , Judge -NAME- -NAME- -NAME- ( D. Kan. ) , Magistrate Judge -NAME- -NAME- -NAME- ( D. Kan. ) on 6/10/2014 ) ( gr ) ( Entered : 06/10/2014 )","ORDER . and shall confer regarding the least burdensome way , which is still effective , for to locate and produce the above-described documents for the relevant approximately 33 % of loans underlying the securitization in question . Any remaining dispute shall be presented to the Court by June 13 , 2014 . IT IS FURTHER ORDERED that shall re-file its letter of June 6 without redactions . Signed by Judge ( S.D.N.Y . ) , Judge ( C.D . Cal . ) , Judge ( D. Kan. ) , Magistrate Judge ( D. Kan. ) on 6/10/2014 ) ( gr ) ( Entered : 06/10/2014 )",order confer least burdensome way still effective locate produce abovedescribed relevant approximately underlying securitization question dispute order refile letter without redaction,,order confer least burdensome way still effective locate produce abovedescribed relevant approximately underlying securitization question dispute order refile letter without redaction,order confer least burdensome way still effective locate produce abovedescribed relevant approximately underlying securitization question dispute order refile letter without redaction,"['order .', 'confer least burdensome way still effective locate produce abovedescribed document relevant approximately % loan underlying securitization question .', 'dispute .', 'order refile letter without redaction .', '']","['order .', 'confer least burdensome way still effective locate produce abovedescribed document relevant approximately % loan underlying securitization question .', 'dispute .', 'order refile letter without redaction .', '']","['order .', 'confer least burdensome way still effective locate produce abovedescribed document relevant approximately % loan underlying securitization question .', 'dispute .', 'order refile letter without redaction .', '']",Court's Order,Y,Triage
"LETTER addressed to Judge Denise L. Cote from James P. Rouhandeh dated 6/13/14 re: On behalf of all Defendants re: Order to show cause why the Courts should not set a deadline of July 11, 2014 to join other parties in these actions.. Document filed by Credit Suisse First Boston Mortgage Securities Corp., Credit Suisse Securities (USA) LLC.(Rouhandeh, James) (Entered: 06/13/2014)",Credit Suisse First Boston Mortgage Securities Corp. Credit Suisse Securities ( USA ) LLC,Denise L. Cote James P. Rouhandeh ( Rouhandeh James,"LETTER addressed to Judge -NAME- -NAME- -NAME- from -NAME- -NAME- -NAME- dated 6/13/14 re : On behalf of all Defendants re : Order to show cause why the Courts should not set a deadline of July 11 , 2014 to join other parties in these actions.. Document filed by -ORG- -ORG- -ORG- -ORG- -ORG- -ORG- -ORG- , -ORG- -ORG- -ORG- -ORG- -ORG- -ORG- -ORG- . -NAME- -NAME- , -NAME- ) ( Entered : 06/13/2014 )","LETTER addressed to Judge from dated 6/13/14 re : On behalf of all Defendants re : Order to show cause why the Courts should not set a deadline of July 11 , 2014 to join other parties in these actions.. Document filed by , . , ) ( Entered : 06/13/2014 )",letter address order show cause deadline join,,letter address order show cause deadline join,letter_address order show_cause deadline join,"['letter address order show cause deadline join actions.. document file .', '']","['letter address order show cause deadline join actions.. document file .', '']","['letter_address order show_cause deadline join actions.. document file .', '']",Letter to Court,Y,Triage
